{
  "pattern_id": "P-auto-077",
  "version": 1,
  "title": "rag / ops — folder-drop-ingest",
  "steps": [
    "Steal folder-drop → ID → chunk count as the checkable stop.",
    "One gold question after ingest, before more graph."
  ],
  "support_ids": [
    "K-Fu6vOfzFmcw-01",
    "K-Fu6vOfzFmcw-02"
  ],
  "dissent_ids": [],
  "valid_when": "domain=rag; stage=ops; Connected Drive; chosen folder; vector store.",
  "less_relevant_when": "One question ≠ RAG accuracy (`other tape: keep RAG accurate`).",
  "confidence": "medium — single-tape support cluster; not frozen",
  "demonstration_count": 0,
  "creator_count": 1,
  "exceptions": "Do not average with dissent_ids. Caption-only. Tape $ UNVERIFIED."
}
