{
  "pattern_id": "P-auto-024",
  "version": 1,
  "title": "agent-ops / guardrail — hosted-agent-always-on-agent",
  "steps": [
    "Steal “hosted ≠ scheduled.” Hive: no Anthropic managed agents, no trigger.dev install.",
    "Steal vault-not-prompt. Operate-never: keys in system prompts."
  ],
  "support_ids": [
    "K-27Y44JYXZJ8-01",
    "K-27Y44JYXZJ8-03"
  ],
  "dissent_ids": [
    "K-27Y44JYXZJ8-04",
    "K-27Y44JYXZJ8-05"
  ],
  "valid_when": "domain=agent-ops; stage=guardrail; His 3-hour pass. Early-access outcomes/memory/multi-agent not on.",
  "less_relevant_when": "Notion’s in-product drag-to-status is a different glue (the host app triggers).",
  "confidence": "medium — single-tape support cluster; not frozen",
  "demonstration_count": 0,
  "creator_count": 1,
  "exceptions": "Do not average with dissent_ids. Caption-only. Tape $ UNVERIFIED."
}
