{
  "pattern_id": "P-auto-004",
  "version": 1,
  "title": "agent-loops / ops — loop-trigger-action-checkable-stop",
  "steps": [
    "Steal checkable-stop. `golden-test-loop`.",
    "Steal metric=Y + hard cap. Don’t treat “satisfied” as done.",
    "Steal job-match + hard stop + cost. No 24/7 hive spend."
  ],
  "support_ids": [
    "K-EuzYhzB0vbI-01",
    "K-EuzYhzB0vbI-02",
    "K-EuzYhzB0vbI-03"
  ],
  "dissent_ids": [],
  "valid_when": "domain=agent-loops; stage=ops; His knowledge-work. Conflicts with “shoot a chunky loop before bed” on the same tape — keep both (experiment vs default)",
  "less_relevant_when": "Product-team maybe. `R0qF17BVl9w` still runs a huge `/goal`. Keep both. Speech≠behavior (keep both; do not pick a winner",
  "confidence": "medium — single-tape support cluster; not frozen",
  "demonstration_count": 0,
  "creator_count": 1,
  "exceptions": "Do not average with dissent_ids. Caption-only. Tape $ UNVERIFIED."
}
