{
  "pattern_id": "P-auto-038",
  "version": 1,
  "title": "evaluation / build — eval-hypothesis-objective-proof",
  "steps": [
    "Write the hypothesis and the expected fields before changing the prompt.",
    "Steal labeled-set + per-row miss list + token/time averages."
  ],
  "support_ids": [
    "K-8IUWeF3B-hk-01",
    "K-8IUWeF3B-hk-02"
  ],
  "dissent_ids": [],
  "valid_when": "domain=evaluation; stage=build; Expected category and priority exist.",
  "less_relevant_when": "No labels → you are still in vibe-check.",
  "confidence": "medium — single-tape support cluster; not frozen",
  "demonstration_count": 0,
  "creator_count": 1,
  "exceptions": "Do not average with dissent_ids. Caption-only. Tape $ UNVERIFIED."
}
