{
  "pattern_id": "P-auto-032",
  "version": 1,
  "title": "content-ops / build — two-tavily-modes-pin-don-t-activate-the-sunday-gun",
  "steps": [
    "Steal two-pass research + pin + inactive trigger. `warm-draft-hitl`.",
    "Steal draft+cite+log. `send-removed` · `info-gain-cite`."
  ],
  "support_ids": [
    "K-pxzo2lXhWJE-03",
    "K-pxzo2lXhWJE-05"
  ],
  "dissent_ids": [
    "K-pxzo2lXhWJE-04",
    "K-pxzo2lXhWJE-06"
  ],
  "valid_when": "domain=content-ops; stage=build; 1,000 free searches UNVERIFIED. Community-node version gate.",
  "less_relevant_when": "He says you can add Perplexity/SERP later.",
  "confidence": "medium — single-tape support cluster; not frozen",
  "demonstration_count": 0,
  "creator_count": 1,
  "exceptions": "Do not average with dissent_ids. Caption-only. Tape $ UNVERIFIED."
}
